{
  "schemaVersion": 2,
  "kind": "skill",
  "generatedAt": "2026-07-24T23:38:51.000Z",
  "packages": [
    {
      "id": "diagnose-missing-recipe",
      "displayName": "Diagnose Missing Recipes",
      "description": "Find out why an expected crafting or processing recipe is missing from the current pack.",
      "publisher": "OpenAllay Community",
      "version": "0.2.1",
      "archive": "https://raw.githubusercontent.com/nkanf-dev/OpenAllay-Skills/main/packages/diagnose-missing-recipe-0.2.1.zip",
      "sha256": "58f0b2bc901d65d5efebfb675b50806f66ed163a3ab2b501f6f8bb8afd87ec4b",
      "compatibility": {
        "minecraft": "[1.12.2,26.3]",
        "openallayApi": "0.2"
      },
      "source": "https://github.com/nkanf-dev/OpenAllay-Skills/tree/main/skills/diagnose-missing-recipe"
    },
    {
      "id": "explain-machine-usage",
      "displayName": "Explain Machine Usage",
      "description": "Learn how to obtain, place, power, configure, and automate a modded machine.",
      "publisher": "OpenAllay Community",
      "version": "0.2.1",
      "archive": "https://raw.githubusercontent.com/nkanf-dev/OpenAllay-Skills/main/packages/explain-machine-usage-0.2.1.zip",
      "sha256": "b242545d18734f06663092a5b548bbc499ed08be9395eda5419e310c30110d61",
      "compatibility": {
        "minecraft": "[1.12.2,26.3]",
        "openallayApi": "0.2"
      },
      "source": "https://github.com/nkanf-dev/OpenAllay-Skills/tree/main/skills/explain-machine-usage"
    },
    {
      "id": "guide-ftb-progression",
      "displayName": "Guide FTB Progression",
      "description": "Follow visible FTB Quests prerequisites, branches, and rewards.",
      "publisher": "OpenAllay Community",
      "version": "0.2.1",
      "archive": "https://raw.githubusercontent.com/nkanf-dev/OpenAllay-Skills/main/packages/guide-ftb-progression-0.2.1.zip",
      "sha256": "cb5f9dd8b23f3ef9cedaa6618fc3594a13769fe7e4ebcaecdf5736516817e996",
      "compatibility": {
        "minecraft": "[1.12.2,26.3]",
        "openallayApi": "0.2"
      },
      "source": "https://github.com/nkanf-dev/OpenAllay-Skills/tree/main/skills/guide-ftb-progression"
    },
    {
      "id": "inspect-game-state",
      "displayName": "Inspect Game State",
      "description": "Correlate settings, F3 diagnostics, packs, mods, and other player-visible game state.",
      "publisher": "OpenAllay Community",
      "version": "0.2.2",
      "archive": "https://raw.githubusercontent.com/nkanf-dev/OpenAllay-Skills/main/packages/inspect-game-state-0.2.2.zip",
      "sha256": "25906732beb9249c66e1ea078e2c2ebdcdf0649873af2d6968c3577fdf513414",
      "compatibility": {
        "minecraft": "[1.12.2,26.3]",
        "openallayApi": "0.2"
      },
      "source": "https://github.com/nkanf-dev/OpenAllay-Skills/tree/main/skills/inspect-game-state"
    },
    {
      "id": "run-game-commands",
      "displayName": "Run Game Commands",
      "description": "Discover and execute Minecraft commands through OpenAllay's experimental command capability.",
      "publisher": "OpenAllay Community",
      "version": "0.2.2",
      "archive": "https://raw.githubusercontent.com/nkanf-dev/OpenAllay-Skills/main/packages/run-game-commands-0.2.2.zip",
      "sha256": "700728d8a5c81606a8da62e4bd676afac4a60b7b927d04ea505909c7fd3851b4",
      "compatibility": {
        "minecraft": "[1.12.2,26.3]",
        "openallayApi": "0.2"
      },
      "source": "https://github.com/nkanf-dev/OpenAllay-Skills/tree/main/skills/run-game-commands"
    },
    {
      "id": "search-guide-books",
      "displayName": "Search Guide Books",
      "description": "Find relevant entries in Patchouli and other indexed in-game guide books.",
      "publisher": "OpenAllay Community",
      "version": "0.2.1",
      "archive": "https://raw.githubusercontent.com/nkanf-dev/OpenAllay-Skills/main/packages/search-guide-books-0.2.1.zip",
      "sha256": "0bd11c5d557d63ddedefa5af29f6324d3fb0341dbe0c5d434c1950c5aa0cd9c2",
      "compatibility": {
        "minecraft": "[1.12.2,26.3]",
        "openallayApi": "0.2"
      },
      "source": "https://github.com/nkanf-dev/OpenAllay-Skills/tree/main/skills/search-guide-books"
    }
  ]
}
